dominio,tipoProjeto,siglaTipoProjeto,numero,ano,autor,ementa,indexacao,situacao,siglaSituacao,situacaoGeral,siglaSituacaoGeral,dataPublicacao,numeroDoc,proposicao,matricula,assuntoGeral,legislacaoCitada,local,norma,arquivamento,atualizacao,horario,usuario,dataUltimaAcao,listaHistoricoTramitacoes,links,linksProposicoesAnexadas,linksOrigem,acompanhamento,regime,autoresEstruturados,observacao,tema,linkLegislacao.url,linkLegislacao.rotulo,tipoTramitacao.codigo,tipoTramitacao.nome,tipoTramitacao.listaFaseTramitacao,faseAtual.codTipoTramitacao,faseAtual.codigo,faseAtual.nome,faseAtual.ordem,faseAtual.descricao
Remissivo,PROJETO DE LEI,PL,1478,1981,DEPUTADO LOURIVAL BRASIL                   ARENA,"DECLARA DE UTILIDADE PÚBLICA O CORAL BACH, COM SEDE NA
CIDADE DE SÃO LOURENÇO.","UTILIDADE PÚBLICA, ENTIDADE, MUNICÍPIO, SÃO LOURENÇO.",TRANSFORMADO EM NORMA JURÍDICA,TNJUR,PROPOSIÇÕES APROVADAS,MAPRV,1981-10-07,000150198,PL. 1478 1981 - PROJETO DE LEI,322,UTILIDADE PÚBLICA,NA,NA,LEI 8138 1981 - LEI ORDINÁRIA,NA,20120131,1518,rosanacf,1981-10-05,"list(passo = 1, data = ""1981-10-05"", local = ""PLENÁRIO"", historico = ""HISTÓRICO DA TRAMITAÇÃO\nPLENÁRIO:\nPRIMEIRA DISCUSSÃO\nAPROVAÇÃO: 4 11 1981\nSEGUNDA DISCUSSÃO\nAPROVAÇÃO: 23 11 1981\nTERCEIRA DISCUSSÃO\nAPROVAÇÃO: 4 12 1981\nREDAÇÃO FINAL\nAPROVAÇÃO: 4 12 1981\nCOMISSÕES:\nJUSTIÇA\nSEGUNDA DISCUSSÃO\nRELATOR: DEP. ROBERTO JUNQUEIRA\nPUBLICAÇÃO: 13 11 1981\nJUSTIÇA\nTERCEIRA DISCUSSÃO\nRELATOR: DEP. CÁSSIO GONÇALVES\nPUBLICAÇÃO: 4 12 1981\nREDAÇÃO\nREDAÇÃO FINAL\nRELATOR: DEP. FERRAZ CALDAS\nPUBLICAÇÃO: 8 12 1981\nSANCIONADO\nPUBLICAÇÃO DA LEI: 29 12 1981."")",list(),list(),NULL,N,DELIBERAÇÃO DE PLENÁRIO,"list(id = 322, nome = ""DEPUTADO LOURIVAL BRASIL"", partido = ""ARENA"")",NA,NA,/legislacao/mineira/LEI/8138/1981,LEI 8138 1981 - LEI ORDINÁRIA,NA,NA,NULL,NA,NA,NA,NA,NA
Remissivo,PROJETO DE LEI,PL,1477,1981,GOVERNADOR DO ESTADO,"DÁ NOVA REDAÇÃO AO ART. 64 DA LEI 6763, DE 26 12 1975, QUE CONSOLIDA A
LEGISLAÇÃO TRIBUTÁRIA DE MINAS GERAIS.
(ALTERA ALÍQUOTAS DO IMPOSTO SOBRE A TRANSMISSÃO DE BENS IMÓVEIS E DE
DIREITOS A ELES RELATIVOS - ITBI).","ALTERAÇÃO, LEI ESTADUAL, CONSOLIDAÇÃO, LEGISLAÇÃO TRIBUTÁRIA, EFEITO,
ALÍQUOTA, (ITBI).",TRANSFORMADO EM NORMA JURÍDICA,TNJUR,PROPOSIÇÕES APROVADAS,MAPRV,1981-10-06,000150200,PL. 1477 1981 - PROJETO DE LEI,,"IMÓVEL
TRIBUTOS",NA,NA,LEI 8100 1981 - LEI ORDINÁRIA,NA,20120605,1721,rosanacf,1981-10-02,"list(passo = 1, data = ""1981-10-02"", local = ""PLENÁRIO"", historico = ""HISTÓRICO DA TRAMITAÇÃO\nPLENÁRIO:\nDISCUSSÃO ÚNICA\nAPROVAÇÃO: 4 11 1981\nREDAÇÃO FINAL\nAPROVAÇÃO: 4 11 1981\nCOMISSÕES:\nJUSTIÇA, ECONOMIA E FINANÇAS (REUNIÃO CONJUNTA)\nDISCUSSÃO ÚNICA\nRELATOR: DEP. EMÍLIO HADDAD\nPUBLICAÇÃO: 23 10 1981\nREDAÇÃO\nREDAÇÃO FINAL\nRELATOR: DEP. LUIZ VICENTE\nPUBLICAÇÃO: 7 11 1981, 13 11 1981 E 27 11 1981\nSANCIONADO\nPUBLICAÇÃO DA LEI: 26 11 1981."")",list(),list(),"list(descricao = ""MSG 549 1981"")",N,NA,NULL,NA,NA,/legislacao/mineira/LEI/8100/1981,LEI 8100 1981 - LEI ORDINÁRIA,NA,NA,NULL,NA,NA,NA,NA,NA
Remissivo,PROJETO DE LEI,PL,1475,1981,DEPUTADO ELMO BRAZ                         PP,"DECLARA DE UTILIDADE PÚBLICA A SOCIEDADE DOS SURDOS DE
BELO HORIZONTE, COM SEDE EM BELO HORIZONTE.","UTILIDADE PÚBLICA, ENTIDADE, MUNICÍPIO, BELO HORIZONTE.",TRANSFORMADO EM NORMA JURÍDICA,TNJUR,PROPOSIÇÕES APROVADAS,MAPRV,1981-10-06,000150201,PL. 1475 1981 - PROJETO DE LEI,1689,UTILIDADE PÚBLICA,NA,NA,LEI 8144 1981 - LEI ORDINÁRIA,NA,20120131,1519,rosanacf,1981-10-02,"list(passo = 1, data = ""1981-10-02"", local = ""PLENÁRIO"", historico = ""HISTÓRICO DA TRAMITAÇÃO\nPLENÁRIO:\nPRIMEIRA DISCUSSÃO\nAPROVAÇÃO: 4 11 1981\nSEGUNDA DISCUSSÃO\nAPROVAÇÃO: 23 11 1981\nTERCEIRA DISCUSSÃO\nAPROVAÇÃO: 3 12 1981\nREDAÇÃO FINAL\nAPROVAÇÃO: 4 12 1981\nCOMISSÕES:\nJUSTIÇA\nSEGUNDA DISCUSSÃO\nRELATOR: DEP. CÁSSIO GONÇALVES\nPUBLICAÇÃO: 17 11 1981\nJUSTIÇA\nTERCEIRA DISCUSSÃO\nRELATOR: DEP. CÁSSIO GONÇALVES\nPUBLICAÇÃO: 2 12 1981\nREDAÇÃO\nREDAÇÃO FINAL\nRELATOR: DEP. EMÍLIO HADDAD\nPUBLICAÇÃO: 8 12 1981\nSANCIONADO\nPUBLICAÇÃO DA LEI: 30 12 1981."")",list(),list(),NULL,N,DELIBERAÇÃO DE PLENÁRIO,"list(id = 1689, nome = ""DEPUTADO ELMO BRAZ"", partido = ""PP"")",NA,NA,/legislacao/mineira/LEI/8144/1981,LEI 8144 1981 - LEI ORDINÁRIA,NA,NA,NULL,NA,NA,NA,NA,NA
Remissivo,PROJETO DE LEI,PL,1474,1981,DEPUTADO CÁSSIO GONÇALVES                  MDB,"DECLARA DE UTILIDADE PÚBLICA A AÇÃO SOCIAL TÉCNICA, COM
SEDE EM BELO HORIZONTE.","UTILIDADE PÚBLICA, ENTIDADE, MUNICÍPIO, BELO HORIZONTE.",TRANSFORMADO EM NORMA JURÍDICA,TNJUR,PROPOSIÇÕES APROVADAS,MAPRV,1981-10-03,000150202,PL. 1474 1981 - PROJETO DE LEI,2033,UTILIDADE PÚBLICA,NA,NA,LEI 8145 1981 - LEI ORDINÁRIA,NA,20120131,1519,rosanacf,1981-10-01,"list(passo = 1, data = ""1981-10-01"", local = ""PLENÁRIO"", historico = ""HISTÓRICO DA TRAMITAÇÃO\nPLENÁRIO:\nPRIMEIRA DISCUSSÃO\nAPROVAÇÃO: 30 10 1981\nSEGUNDA DISCUSSÃO\nAPROVAÇÃO: 2 12 1981\nTERCEIRA DISCUSSÃO\nAPROVAÇÃO: 4 12 1981\nREDAÇÃO FINAL\nAPROVAÇÃO: 4 12 1981\nCOMISSÕES:\nJUSTIÇA\nSEGUNDA DISCUSSÃO\nRELATOR: DEP. MENDES BARROS\nPUBLICAÇÃO: 1 12 1981\nJUSTIÇA\nTERCEIRA DISCUSSÃO\nRELATOR: DEP. FERRAZ CALDAS\nPUBLICAÇÃO: 4 12 1981\nREDAÇÃO\nREDAÇÃO FINAL\nRELATOR: DEP. EMÍLIO HADDAD\nPUBLICAÇÃO: 8 12 1981\nSANCIONADO\nPUBLICAÇÃO DA LEI: 30 12 1981."")",list(),list(),NULL,N,DELIBERAÇÃO DE PLENÁRIO,"list(id = 2033, nome = ""DEPUTADO CÁSSIO GONÇALVES"", partido = ""MDB"")",NA,NA,/legislacao/mineira/LEI/8145/1981,LEI 8145 1981 - LEI ORDINÁRIA,NA,NA,NULL,NA,NA,NA,NA,NA
Remissivo,PROJETO DE LEI,PL,1473,1981,DEPUTADO RAIMUNDO ALBERGARIA               PDS,"AUTORIZA O PODER EXECUTIVO A INSTITUIR TABELA ESPECIAL DE
PROVENTOS PARA SERVIDOR INATIVO, MAIOR DE 80 ANOS.",NA,ARQUIVADO,ARQVD,OUTRAS SITUAÇÕES,MOUTR,1981-10-03,000150203,PL. 1473 1981 - PROJETO DE LEI,1698,NA,NA,ARQUIVO,NA,19830131,20090406,0922,m17663,1981-10-01,"list(passo = 1, data = ""1981-10-01"", local = ""PLENÁRIO"", historico = ""ARQUIVADO, FINAL DE LEGISLATURA."")",list(),list(),NULL,N,NA,"list(id = 1698, nome = ""DEPUTADO RAIMUNDO ALBERGARIA"", partido = ""PDS"")",NA,NA,NA,NA,NA,NA,NULL,NA,NA,NA,NA,NA
Remissivo,PROJETO DE LEI,PL,1472,1981,DEPUTADO MENDES BARROS                     PMDB,"DECLARA DE UTILIDADE PÚBLICA A CORPORAÇÃO MUSICAL EUTERPE
LAGOANA, COM SEDE NA CIDADE DE NOVA ERA.","UTILIDADE PÚBLICA, ENTIDADE, MUNICÍPIO, NOVA ERA.",ARQUIVADO,ARQVD,OUTRAS SITUAÇÕES,MOUTR,1981-10-03,000150204,PL. 1472 1981 - PROJETO DE LEI,1688,UTILIDADE PÚBLICA,NA,ARQUIVO,NA,19830131,20120131,1519,rosanacf,1981-10-01,"list(passo = 1, data = ""1981-10-01"", local = ""PLENÁRIO"", historico = ""HISTÓRICO DA TRAMITAÇÃO\nPLENÁRIO:\nPRIMEIRA DISCUSSÃO.\nAPROVAÇÃO: 30 10 1981\nARQUIVADO, FINAL DE LEGISLATURA."")",list(),list(),NULL,N,NA,"list(id = 1688, nome = ""DEPUTADO MENDES BARROS"", partido = ""PMDB"")",NA,NA,NA,NA,NA,NA,NULL,NA,NA,NA,NA,NA
Remissivo,PROJETO DE LEI,PL,1464,1981,DEPUTADO ADEMIR LUCAS                      PMDB,"DECLARA DE UTILIDADE PÚBLICA O CAMPOLINA FUTEBOL CLUBE,
COM SEDE NA CIDADE DE ESMERALDAS.","UTILIDADE PÚBLICA, ENTIDADE, MUNICÍPIO, ESMERALDAS.",TRANSFORMADO EM NORMA JURÍDICA,TNJUR,PROPOSIÇÕES APROVADAS,MAPRV,1981-10-01,000150213,PL. 1464 1981 - PROJETO DE LEI,2030,UTILIDADE PÚBLICA,NA,NA,LEI 8147 1981 - LEI ORDINÁRIA,NA,20120131,1520,rosanacf,1981-09-29,"list(passo = 1, data = ""1981-09-29"", local = ""PLENÁRIO"", historico = ""HISTÓRICO DA TRAMITAÇÃO\nPLENÁRIO:\nPRIMEIRA DISCUSSÃO\nAPROVAÇÃO: 30 10 1981\nSEGUNDA DISCUSSÃO\nAPROVAÇÃO: 23 11 1981\nTERCEIRA DISCUSSÃO\nAPROVAÇÃO: 3 12 1981\nREDAÇÃO FINAL\nAPROVAÇÃO: 4 12 1981\nCOMISSÕES:\nJUSTIÇA\nSEGUNDA DISCUSSÃO\nRELATOR: DEP. CÁSSIO GONÇALVES\nPUBLICAÇÃO: 13 11 1981\nJUSTIÇA\nTERCEIRA DISCUSSÃO\nRELATOR: DEP. FERRAZ CALDAS\nPUBLICAÇÃO: 2 12 1981\nREDAÇÃO\nREDAÇÃO FINAL\nRELATOR: DEP. EMÍLIO HADDAD\nPUBLICAÇÃO: 8 12 1981\nSANCIONADO\nPUBLICAÇÃO DA LEI: 30 12 1981"")",list(),list(),NULL,N,DELIBERAÇÃO DE PLENÁRIO,"list(id = 2030, nome = ""DEPUTADO ADEMIR LUCAS"", partido = ""PMDB"")",NA,NA,/legislacao/mineira/LEI/8147/1981,LEI 8147 1981 - LEI ORDINÁRIA,NA,NA,NULL,NA,NA,NA,NA,NA
Remissivo,PROJETO DE LEI,PL,1463,1981,DEPUTADO FERRAZ CALDAS                     PMDB,"DECLARA DE UTILIDADE PÚBLICA A SOCIEDADE UNIDOS DE
SANTA TEREZA, COM SEDE EM CAXAMBU.","UTILIDADE PÚBLICA, ENTIDADE, MUNICÍPIO, CAXAMBU.",TRANSFORMADO EM NORMA JURÍDICA,TNJUR,PROPOSIÇÕES APROVADAS,MAPRV,1981-10-01,000150214,PL. 1463 1981 - PROJETO DE LEI,1690,UTILIDADE PÚBLICA,NA,NA,LEI 8146 1981 - LEI ORDINÁRIA,NA,20120131,1520,rosanacf,1981-09-29,"list(passo = 1, data = ""1981-09-29"", local = ""PLENÁRIO"", historico = ""HISTÓRICO DA TRAMITAÇÃO\nPLENÁRIO:\nPRIMEIRA DISCUSSÃO\nAPROVAÇÃO: 30 10 1981\nSEGUNDA DISCUSSÃO\nAPROVAÇÃO: 23 11 1981\nTERCEIRA DISCUSSÃO\nAPROVAÇÃO: 3 12 1981\nREDAÇÃO FINAL\nAPROVAÇÃO: 4 12 1981\nCOMISSÕES:\nJUSTIÇA\nSEGUNDA DISCUSSÃO\nRELATOR: DEP. CÁSSIO GONÇALVES\nPUBLICAÇÃO: 13 11 1981\nJUSTIÇA\nTERCEIRA DISCUSSÃO\nRELATOR: DEP. EMÍLIO HADDAD\nPUBLICAÇÃO: 2 12 1981\nREDAÇÃO\nREDAÇÃO FINAL\nRELATOR: DEP. EMÍLIO HADDAD\nPUBLICAÇÃO: 8 12 1981\nSANCIONADO\nPUBLICAÇÃO DA LEI: 30 12 1981."")",list(),list(),NULL,N,DELIBERAÇÃO DE PLENÁRIO,"list(id = 1690, nome = ""DEPUTADO FERRAZ CALDAS"", partido = ""PMDB"")",NA,NA,/legislacao/mineira/LEI/8146/1981,LEI 8146 1981 - LEI ORDINÁRIA,NA,NA,NULL,NA,NA,NA,NA,NA
Remissivo,PROJETO DE LEI,PL,1462,1981,DEPUTADO FERRAZ CALDAS                     PMDB,"DECLARA DE UTILIDADE PÚBLICA O CENTRO ESPÍRITA PAULO DE
TARSO, COM SEDE EM TRÊS PONTAS.","UTILIDADE PÚBLICA, ENTIDADE, MUNICÍPIO, TRÊS PONTAS.",TRANSFORMADO EM NORMA JURÍDICA,TNJUR,PROPOSIÇÕES APROVADAS,MAPRV,1981-10-01,000150215,PL. 1462 1981 - PROJETO DE LEI,1690,UTILIDADE PÚBLICA,NA,NA,LEI 8150 1981 - LEI ORDINÁRIA,NA,20120131,1521,rosanacf,1981-09-29,"list(passo = 1, data = ""1981-09-29"", local = ""PLENÁRIO"", historico = ""HISTÓRICO DA TRAMITAÇÃO\nPLENÁRIO:\nPRIMEIRA DISCUSSÃO\nAPROVAÇÃO: 30 10 1981\nSEGUNDA DISCUSSÃO\nAPROVAÇÃO: 23 11 1981\nTERCEIRA DISCUSSÃO\nAPROVAÇÃO: 4 12 1981\nREDAÇÃO FINAL\nAPROVAÇÃO: 4 12 1981\nCOMISSÕES:\nJUSTIÇA\nSEGUNDA DISCUSSÃO\nRELATOR: DEP. ROBERTO JUNQUEIRA\nPUBLICAÇÃO: 13 11 1981\nJUSTIÇA\nTERCEIRA DISCUSSÃO\nRELATOR: DEP. CÁSSIO GONÇALVES\nPUBLICAÇÃO: 4 12 1981\nREDAÇÃO\nREDAÇÃO FINAL\nRELATOR: DEP. NARCÉLIO MENDES\nPUBLICAÇÃO: 8 12 1981\nSANCIONADO\nPUBLICAÇÃO DA LEI: 30 12 1981."")",list(),list(),NULL,N,DELIBERAÇÃO DE PLENÁRIO,"list(id = 1690, nome = ""DEPUTADO FERRAZ CALDAS"", partido = ""PMDB"")",NA,NA,/legislacao/mineira/LEI/8150/1981,LEI 8150 1981 - LEI ORDINÁRIA,NA,NA,NULL,NA,NA,NA,NA,NA
Remissivo,PROJETO DE LEI,PL,1461,1981,DEPUTADO EMÍLIO GALLO                      ARENA,"ACRESCENTA PARÁGRAFO AO ART. 7 DA LEI 7109, DE 13 DE OUTUBRO DE 1977
(ALTERA O ESTATUTO DO MAGISTÉRIO PÚBLICO ESTENDENDO AO ORIENTADOR
EDUCACIONAL, SUPERVISOR PEDAGÓGICO, INSPETOR ESCOLAR, ADMINISTRADOR
EDUCACIONAL E DIRETOR DE ESCOLA O DIREITO DE APOSENTADORIA APÓS 25 OU 30
ANOS DE SERVIÇO).","ALTERAÇÃO, ESTATUTO DO MAGISTÉRIO.
ALTERAÇÃO, DEFINIÇÃO, CARGO PÚBLICO, PROFESSOR, OBJETIVO,
APOSENTADORIA, OCUPANTE, SÉRIE DE CLASSE, QUADRO DE PESSOAL,
MAGISTÉRIO.
NORMAS, VENCIMENTOS, JORNADA DE TRABALHO, OCUPANTE, CARGO PÚBLICO,
INSPETOR ESCOLAR.
FIXAÇÃO, QUANTIDADE, CARGO PÚBLICO, SÉRIE DE CLASSE, INSPETOR ESCOLAR.
AUTORIZAÇÃO, EXECUTIVO, ABERTURA, CRÉDITO SUPLEMENTAR.",TRANSFORMADO EM NORMA JURÍDICA,TNJUR,PROPOSIÇÕES APROVADAS,MAPRV,1981-10-01,000150216,PL. 1461 1981 - PROJETO DE LEI,1683,"PESSOAL
SECRETARIA DE ESTADO",NA,NA,LEI 8131 1981 - LEI ORDINÁRIA,NA,20150219,1555,m17461,1981-09-29,"list(passo = 1, data = ""1981-09-29"", local = ""PLENÁRIO"", historico = ""HISTÓRICO DA TRAMITAÇÃO\nPLENÁRIO:\nPRIMEIRA DISCUSSÃO\nAPROVAÇÃO: 30 10 1981\nSEGUNDA DISCUSSÃO\nAPROVAÇÃO: 27 11 1981\nTERCEIRA DISCUSSÃO\nAPROVAÇÃO: 1 12 1981\nREDAÇÃO FINAL\nAPROVAÇÃO: 2 12 1981\nCOMISSÕES:\nJUSTIÇA\nSEGUNDA DISCUSSÃO\nRELATOR: DEP. EMÍLIO HADDAD\nPUBLICAÇÃO: 26 11 1981\nSERVIÇO PÚBLICO\nSEGUNDA DISCUSSÃO\nRELATOR: DEP. EMÍLIO HADDAD\nPUBLICAÇÃO: 26 11 1981\nSERVIÇO PÚBLICO\nTERCEIRA DISCUSSÃO\nRELATOR: DEP. EMÍLIO HADDAD\nPUBLICAÇÃO: 28 11 1981\nREDAÇÃO\nREDAÇÃO FINAL\nRELATOR: DEP. FÚLVIO FONTOURA\nPUBLICAÇÃO: 4 12 1981\nSANCIONADO\nPUBLICAÇÃO DA LEI: 23 12 1981."")",list(),list(),NULL,N,DELIBERAÇÃO DE PLENÁRIO,"list(id = 1683, nome = ""DEPUTADO EMÍLIO GALLO"", partido = ""ARENA"")",NA,"ADMINISTRAÇÃO PÚBLICA
EDUCAÇÃO",/legislacao/mineira/LEI/8131/1981,LEI 8131 1981 - LEI ORDINÁRIA,NA,NA,NULL,NA,NA,NA,NA,NA
Remissivo,PROJETO DE LEI,PL,1460,1981,DEPUTADO JOÃO FERRAZ                       PDS,"AUTORIZA O PODER EXECUTIVO A DOAR IMÓVEL À ASSOCIAÇÃO DE PROTEÇÃO À
MATERNIDADE, À INFÂNCIA E À ADOLESCÊNCIA DE PIUMHI - APROMIP.","AUTORIZAÇÃO, EXECUTIVO, DOAÇÃO, IMÓVEL, MUNICÍPIO, PIUMHI.",TRANSFORMADO EM NORMA JURÍDICA,TNJUR,PROPOSIÇÕES APROVADAS,MAPRV,1981-09-29,000150218,PL. 1460 1981 - PROJETO DE LEI,1171,IMÓVEL,NA,NA,LEI 8118 1981 - LEI ORDINÁRIA,NA,20120605,1722,rosanacf,1981-09-25,"list(passo = 1, data = ""1981-09-25"", local = ""PLENÁRIO"", historico = ""HISTÓRICO DA TRAMITAÇÃO\nPLENÁRIO:\nPRIMEIRA DISCUSSÃO\nAPROVAÇÃO: 1 10 1981\nSEGUNDA DISCUSSÃO\nAPROVAÇÃO: 6 11 1981\nTERCEIRA DISCUSSÃO\nAPROVAÇÃO: 13 11 1981\nREDAÇÃO FINAL\nAPROVAÇÃO: 16 11 1981\nCOMISSÕES:\nJUSTIÇA, ECONOMIA E FINANÇAS (REUNIÃO CONJUNTA)\nSEGUNDA DISCUSSÃO\nRELATOR: DEP. MÁRIO PACHECO\nPUBLICAÇÃO: 10 10 1981\nFINANÇAS\nTERCEIRA DISCUSSÃO\nRELATOR: DEP. EMÍLIO HADDAD\nPUBLICAÇÃO: 11 11 1981\nREDAÇÃO\nREDAÇÃO FINAL\nRELATOR: DEP. CAMILO MACHADO\nPUBLICAÇÃO: 17 11 1981\nSANCIONADO\nPUBLICAÇÃO DA LEI: 4 12 1981."")",list(),list(),NULL,N,NA,"list(id = 1171, nome = ""DEPUTADO JOÃO FERRAZ"", partido = ""PDS"")",NA,NA,/legislacao/mineira/LEI/8118/1981,LEI 8118 1981 - LEI ORDINÁRIA,NA,NA,NULL,NA,NA,NA,NA,NA
Remissivo,PROJETO DE LEI,PL,1459,1981,DEPUTADO JOSÉ HONÓRIO                      PDS,"DÁ A DENOMINAÇÃO DE ESCOLA ESTADUAL ALBERTO VICENTE PEREIRA À ESCOLA
ESTADUAL DO DISTRITO DE DIVISÓPOLIS, NO MUNICÍPIO DE ALMENARA.","DENOMINAÇÃO, ESTABELECIMENTO DE ENSINO, MUNICÍPIO, ALMENARA.",TRANSFORMADO EM NORMA JURÍDICA,TNJUR,PROPOSIÇÕES APROVADAS,MAPRV,1981-09-29,000150219,PL. 1459 1981 - PROJETO DE LEI,787,"PRÓPRIO PÚBLICO
ESTABELECIMENTO DE ENSINO",NA,NA,LEI 8186 1982 - LEI ORDINÁRIA,NA,20120507,1659,rosanacf,1981-09-25,"list(passo = 1, data = ""1981-09-25"", local = ""PLENÁRIO"", historico = ""HISTÓRICO DA TRAMITAÇÃO\nPLENÁRIO:\nPRIMEIRA DISCUSSÃO\nAPROVAÇÃO: 1 10 1981\nSEGUNDA DISCUSSÃO\nAPROVAÇÃO: 24 3 1982\nTERCEIRA DISCUSSÃO\nAPROVAÇÃO: 2 4 1982\nREDAÇÃO FINAL\nAPROVAÇÃO: 13 4 1982\nCOMISSÕES:\nJUSTIÇA\nSEGUNDA DISCUSSÃO\nRELATOR: DEP. EMÍLIO HADDAD\nPUBLICAÇÃO: 18 3 1982\nJUSTIÇA\nTERCEIRA DISCUSSÃO\nRELATOR: DEP. NARCISO MICHELLI\nPUBLICAÇÃO: 1 4 1982\nREDAÇÃO\nREDAÇÃO FINAL\nRELATOR: DEP. NARCÉLIO MENDES\nPUBLICAÇÃO: 16 4 1982\nSANCIONADO\nPUBLICAÇÃO DA LEI: 4 5 1982."")",list(),list(),NULL,N,NA,"list(id = 787, nome = ""DEPUTADO JOSÉ HONÓRIO"", partido = ""PDS"")",NA,NA,/legislacao/mineira/LEI/8186/1982,LEI 8186 1982 - LEI ORDINÁRIA,NA,NA,NULL,NA,NA,NA,NA,NA
Remissivo,PROJETO DE LEI,PL,1458,1981,DEPUTADO JOÃO FERRAZ                       PDS,"DÁ A DENOMINAÇÃO DE ESCOLA ESTADUAL JUCA MARIA À ESCOLA ESTADUAL DE
JOSENÓPOLIS - O.2.0.A, NO MUNICÍPIO DE GRÃO-MOGOL.","DENOMINAÇÃO, ESTABELECIMENTO DE ENSINO, MUNICÍPIO, GRÃO-MOGOL.",TRANSFORMADO EM NORMA JURÍDICA,TNJUR,PROPOSIÇÕES APROVADAS,MAPRV,1981-09-29,000150220,PL. 1458 1981 - PROJETO DE LEI,1171,"PRÓPRIO PÚBLICO
ESTABELECIMENTO DE ENSINO",NA,NA,LEI 8368 1982 - LEI ORDINÁRIA,NA,20120507,1701,rosanacf,1981-09-25,"list(passo = 1, data = ""1981-09-25"", local = ""PLENÁRIO"", historico = ""HISTÓRICO DA TRAMITAÇÃO\nPLENÁRIO:\nPRIMEIRA DISCUSSÃO\nAPROVAÇÃO: 1 10 1981\nSEGUNDA DISCUSSÃO\nAPROVAÇÃO: 26 11 1982\nTERCEIRA DISCUSSÃO\nAPROVAÇÃO: 2 12 1982\nREDAÇÃO FINAL\nAPROVAÇÃO: 4 12 1982\nCOMISSÕES:\nJUSTIÇA\nSEGUNDA DISCUSSÃO\nRELATOR: DEP. LEÃO BORGES\nPUBLICAÇÃO: 25 11 1982\nJUSTIÇA\nTERCEIRA DISCUSSÃO\nRELATOR: DEP. EMÍLIO HADDAD\nPUBLICAÇÃO: 1 12 1982\nREDAÇÃO\nREDAÇÃO FINAL\nRELATOR: DEP. EMÍLIO HADDAD\nPUBLICAÇÃO: 10 12 1982\nSANCIONADO\nPUBLICAÇÃO DA LEI: 22 12 1982."")",list(),list(),NULL,N,NA,"list(id = 1171, nome = ""DEPUTADO JOÃO FERRAZ"", partido = ""PDS"")",NA,NA,/legislacao/mineira/LEI/8368/1982,LEI 8368 1982 - LEI ORDINÁRIA,NA,NA,NULL,NA,NA,NA,NA,NA
Remissivo,PROJETO DE LEI,PL,1456,1981,DEPUTADO HÉLIO RESENDE                     PFL,"CONCEDE O TÍTULO DE CIDADANIA HONORÁRIA DE MINAS GERAIS A
IGNACIO DE LIMA FERREIRA.",NA,TRANSFORMADO EM NORMA JURÍDICA,TNJUR,PROPOSIÇÕES APROVADAS,MAPRV,1981-09-26,000150223,PL. 1456 1981 - PROJETO DE LEI,2037,NA,NA,NA,LEI 8333 1982 - LEI ORDINÁRIA,NA,19980101,NA,Carga,1981-09-24,"list(passo = 1, data = ""1981-09-24"", local = ""PLENÁRIO"", historico = ""HISTÓRICO DA TRAMITAÇÃO\nPLENÁRIO:\nPRIMEIRA DISCUSSÃO\nAPROVAÇÃO: 1 10 1981\nSEGUNDA DISCUSSÃO\nAPROVAÇÃO: 5 10 1982\nTERCEIRA DISCUSSÃO\nAPROVAÇÃO: 28 10 1982\nREDAÇÃO FINAL\nAPROVAÇÃO: 19 11 1982\nCOMISSÕES:\nCONSELHO PERMANENTE DA MEDALHA DA INCONFIDÊNCIA\nRELATOR: CONSELHEIRO GAMALIEL HERVAL\nPARECER FAVORÁVEL\nJUSTIÇA\nSEGUNDA DISCUSSÃO\nRELATOR: DEP. MÁRIO PACHECO\nPUBLICAÇÃO: 11 9 1982\nJUSTIÇA\nTERCEIRA DISCUSSÃO\nRELATOR: DEP. HIDELBRANDO CANABRAVA\nPUBLICAÇÃO: 15 10 1982\nREDAÇÃO\nREDAÇÃO FINAL\nRELATOR: DEP. FÁBIO VASCONCELLOS\nPUBLICAÇÃO: 23 11 1982\nSANCIONADO\nPUBLICAÇÃO DA LEI: 1 12 1982."")",list(),list(),NULL,N,DELIBERAÇÃO DE PLENÁRIO,"list(id = 2037, nome = ""DEPUTADO HÉLIO RESENDE"", partido = ""PFL"")",NA,NA,/legislacao/mineira/LEI/8333/1982,LEI 8333 1982 - LEI ORDINÁRIA,NA,NA,NULL,NA,NA,NA,NA,NA
Remissivo,PROJETO DE LEI,PL,1455,1981,DEPUTADO ADEMIR LUCAS                      PMDB,"DISPÕE SOBRE A FISCALIZAÇÃO DAS ENTIDADES PARAESTATAIS
VINCULADAS AO ESTADO DE MINAS GERAIS E DÁ OUTRAS PROVIDÊNCIAS.",NA,ARQUIVADO,ARQVD,OUTRAS SITUAÇÕES,MOUTR,1981-09-26,000150224,PL. 1455 1981 - PROJETO DE LEI,2030,NA,NA,ARQUIVO,NA,19830131,20090402,1341,m17663,1981-09-24,"list(passo = 1, data = ""1981-09-24"", local = ""PLENÁRIO"", historico = ""HISTÓRICO DA TRAMITAÇÃO:\nPLENÁRIO:\nPRIMEIRA DISCUSSÃO.\nAPROVAÇÃO: 30 10 1982\nJUSTIÇA\nSEGUNDA DISCUSSÃO\nRELATOR: DEP. MÁRIO PACHECO\nPERDEU PRAZO\nFISCALIZAÇÃO FINANCEIRA\nSEGUNDA DISCUSSÃO\nRELATOR: DEP. EMÍLIO HADDAD\nPUBLICAÇÃO: 30 10 1982\nFINANÇAS\nSEGUNDA DISCUSSÃO\nRELATOR: DEP. NARCISO MICHELLI\nPUBLICAÇÃO: 30 10 1982\nARQUIVADO, FINAL DE LEGISLATURA."")",list(),list(),NULL,N,NA,"list(id = 2030, nome = ""DEPUTADO ADEMIR LUCAS"", partido = ""PMDB"")",NA,NA,NA,NA,NA,NA,NULL,NA,NA,NA,NA,NA
Remissivo,PROJETO DE LEI,PL,1454,1981,DEPUTADO JOSÉ HONÓRIO                      PDS,"AUTORIZA REVERSÃO DE IMÓVEL QUE MENCIONA À PREFEITURA MUNICIPAL DE
ALAGOA, COMARCA DE ITANHANDU.","AUTORIZAÇÃO, EXECUTIVO, REVERSÃO, IMÓVEL, MUNICÍPIO, ALAGOA.",TRANSFORMADO EM NORMA JURÍDICA,TNJUR,PROPOSIÇÕES APROVADAS,MAPRV,1981-09-26,000150225,PL. 1454 1981 - PROJETO DE LEI,787,IMÓVEL,NA,NA,LEI 8153 1982 - LEI ORDINÁRIA,NA,20120605,1723,rosanacf,1981-09-24,"list(passo = 1, data = ""1981-09-24"", local = ""PLENÁRIO"", historico = ""HISTÓRICO DA TRAMITAÇÃO\nPLENÁRIO:\nPRIMEIRA DISCUSSÃO\nAPROVAÇÃO: 6 11 1981\nSEGUNDA DISCUSSÃO\nAPROVAÇÃO: 2 12 1981\nTERCEIRA DISCUSSÃO\nAPROVAÇÃO: 16 3 1982\nREDAÇÃO FINAL\nAPROVAÇÃO: 18 3 1982\nCOMISSÕES:\nJUSTIÇA\nSEGUNDA DISCUSSÃO\nRELATOR: DEP. EMÍLIO HADDAD\nPUBLICAÇÃO: 1 12 1981\nECONOMIA\nSEGUNDA DISCUSSÃO\nRELATOR: DEP. EMÍLIO HADDAD\nPUBLICAÇÃO: 1 12 1981\nFINANÇAS\nSEGUNDA DISCUSSÃO\nRELATOR: DEP. EMÍLIO HADDAD\nPUBLICAÇÃO: 1 12 1981\nFINANÇAS\nTERCEIRA DISCUSSÃO\nRELATOR: DEP. NARCISO MICHELLI\nPUBLICAÇÃO: 11 3 1982\nREDAÇÃO\nREDAÇÃO FINAL\nRELATOR: DEP. EMÍLIO HADDAD\nPUBLICAÇÃO: 19 3 1982\nSANCIONADO\nPUBLICAÇÃO DA LEI: 6 4 1982"")",list(),list(),NULL,N,NA,"list(id = 787, nome = ""DEPUTADO JOSÉ HONÓRIO"", partido = ""PDS"")",NA,NA,/legislacao/mineira/LEI/8153/1982,LEI 8153 1982 - LEI ORDINÁRIA,NA,NA,NULL,NA,NA,NA,NA,NA
Remissivo,PROJETO DE LEI,PL,1453,1981,DEPUTADO OTACÍLIO MIRANDA                  PDT,"DÁ AO CENTRO DE SAÚDE DE PERDIGÃO, A DENOMINAÇÃO DE GERALDO EDUARDO DA
SILVA.","DENOMINAÇÃO, CENTRO DE SAÚDE, MUNICÍPIO, PERDIGÃO.",TRANSFORMADO EM NORMA JURÍDICA,TNJUR,PROPOSIÇÕES APROVADAS,MAPRV,1981-09-26,000150226,PL. 1453 1981 - PROJETO DE LEI,2048,PRÓPRIO PÚBLICO,NA,NA,LEI 8171 1982 - LEI ORDINÁRIA,NA,20120507,1702,rosanacf,1981-09-24,"list(passo = 1, data = ""1981-09-24"", local = ""PLENÁRIO"", historico = ""HISTÓRICO DA TRAMITAÇÃO\nPLENÁRIO:\nPRIMEIRA DISCUSSÃO\nAPROVAÇÃO: 1 10 1981\nSEGUNDA DISCUSSÃO\nAPROVAÇÃO: 8 3 1982\nTERCEIRA DISCUSSÃO\nAPROVAÇÃO: 17 3 1982\nREDAÇÃO FINAL\nAPROVAÇÃO: 23 3 1982\nCOMISSÕES:\nJUSTIÇA\nSEGUNDA DISCUSSÃO\nRELATOR: DEP. EMÍLIO HADDAD\nPUBLICAÇÃO: 8 12 1981\nJUSTIÇA\nTERCEIRA DISCUSSÃO\nRELATOR: DEP. ROBERTO JUNQUEIRA\nPUBLICAÇÃO: 13 3 1982\nREDAÇÃO\nREDAÇÃO FINAL\nRELATOR: DEP. EMÍLIO HADDAD\nPUBLICAÇÃO: 23 3 1982\nSANCIONADO\nPUBLICAÇÃO DA LEI: 28 4 1982."")",list(),list(),NULL,N,NA,"list(id = 2048, nome = ""DEPUTADO OTACÍLIO MIRANDA"", partido = ""PDT"")",NA,NA,/legislacao/mineira/LEI/8171/1982,LEI 8171 1982 - LEI ORDINÁRIA,NA,NA,NULL,NA,NA,NA,NA,NA
Remissivo,PROJETO DE LEI,PL,1452,1981,DEPUTADO SÉRGIO EMÍLIO                     PMDB,RESGUARDA ESPÉCIMES ANIMAIS E VEGETAIS E DÁ OUTRAS PROVIDÊNCIAS.,NA,ARQUIVADO,ARQVD,OUTRAS SITUAÇÕES,MOUTR,1981-09-26,000150227,PL. 1452 1981 - PROJETO DE LEI,2052,NA,NA,ARQUIVO,NA,19830131,20090402,1158,m17663,1981-09-24,"list(passo = 1, data = ""1981-09-24"", local = ""PLENÁRIO"", historico = ""HISTÓRICO DA TRAMITAÇÃO\nPLENÁRIO:\nPRIMEIRA DISCUSSÃO.\nAPROVAÇÃO: 30 10 1981\nARQUIVADO, FINAL DE LEGISLATURA."")",list(),list(),NULL,N,NA,"list(id = 2052, nome = ""DEPUTADO SÉRGIO EMÍLIO"", partido = ""PMDB"")",NA,NA,NA,NA,NA,NA,NULL,NA,NA,NA,NA,NA
Remissivo,PROJETO DE LEI,PL,1449,1981,GOVERNADOR DO ESTADO,"ESTIMA A RECEITA E FIXA A DESPESA DO ESTADO DE MINAS GERAIS PARA O
EXERCÍCIO DE 1982. (LOA 1982)",NA,TRANSFORMADO EM NORMA JURÍDICA,TNJUR,PROPOSIÇÕES APROVADAS,MAPRV,1981-09-25,000150228,PL. 1449 1981 - PROJETO DE LEI,,"ADMINISTRAÇÃO ESTADUAL
ORÇAMENTO",NA,NA,LEI 8120 1981 - LEI ORDINÁRIA,NA,20131016,1435,rosanacf,1981-09-23,"list(passo = 1, data = ""1981-09-23"", local = ""PLENÁRIO"", historico = ""HISTÓRICO DA TRAMITAÇÃO\nPLENÁRIO:\nPRIMEIRA DISCUSSÃO\nAPROVAÇÃO: 4 11 1981\nSEGUNDA DISCUSSÃO\nAPROVAÇÃO: 23 11 1981\nTERCEIRA DISCUSSÃO\nAPROVAÇÃO: NÃO CONSTA\nREDAÇÃO FINAL\nAPROVAÇÃO: 25 11 1981\nCOMISSÕES:\nFINANÇAS\nPRIMEIRA DISCUSSÃO\nRELATOR: DEP. JOÃO FERRAZ\nPUBLICAÇÃO: 31 10 1981\nFINANÇAS\nSEGUNDA DISCUSSÃO\nRELATOR: DEP. EMÍLIO HADDAD\nPUBLICAÇÃO: 18 11 1981\nREDAÇÃO\nREDAÇÃO FINAL\nRELATOR: DEP. EMÍLIO HADDAD\nPUBLICAÇÃO: 27 11 1981 E 4 12 1981\nSANCIONADO\nPUBLICAÇÃO DA LEI: 5 12 1981."")",list(),list(),"list(descricao = ""MSG 548 1981"")",N,DELIBERAÇÃO DE PLENÁRIO,NULL,NA,"ADMINISTRAÇÃO PÚBLICA
FINANÇAS PÚBLICAS",/legislacao/mineira/LEI/8120/1981,LEI 8120 1981 - LEI ORDINÁRIA,NA,NA,NULL,NA,NA,NA,NA,NA
