dominio,tipoProjeto,siglaTipoProjeto,numero,ano,autor,ementa,tema,indexacao,situacao,siglaSituacao,situacaoGeral,siglaSituacaoGeral,dataPublicacao,numeroDoc,proposicao,matricula,regime,assuntoGeral,norma,atualizacao,horario,usuario,dataUltimaAcao,listaHistoricoTramitacoes,links,linksProposicoesAnexadas,linksOrigem,acompanhamento,local,arquivamento,autoresEstruturados,observacao,legislacaoCitada,linkLegislacao.url,linkLegislacao.rotulo,tipoTramitacao.codigo,tipoTramitacao.nome,tipoTramitacao.listaFaseTramitacao,faseAtual.codTipoTramitacao,faseAtual.codigo,faseAtual.nome,faseAtual.ordem,faseAtual.descricao
Remissivo,PROJETO DE LEI,PL,2034,1985,GOVERNADOR DO ESTADO,"INSTITUI O IMPOSTO SOBRE A PROPRIEDADE DE VEÍCULOS AUTOMOTORES E DÁ
OUTRAS PROVIDÊNCIAS.",FINANÇAS PÚBLICAS,"NORMAS, CRIAÇÃO, BASE DE CÁLCULO, FIXAÇÃO, ALÍQUOTA, (IPVA).
NORMAS, ISENÇÃO, RECOLHIMENTO, PAGAMENTO, (IPVA).
DESTINAÇÃO, MUNICÍPIOS, PERCENTAGEM, ARRECADAÇÃO, (IPVA).",TRANSFORMADO EM NORMA JURÍDICA COM VETO PARCIAL,TNJVP,PROPOSIÇÕES APROVADAS,MAPRV,1985-12-12,000147322,PL. 2034 1985 - PROJETO DE LEI,,DELIBERAÇÃO DE PLENÁRIO,"TRIBUTOS
IMPOSTO SOBRE A PROPRIEDADE DE VEÍCULOS AUTOMOTORES (IPVA)",LEI 9119 1985 - LEI ORDINÁRIA,20131014,1634,rosanacf,1985-12-11,"list(passo = 1, data = ""1985-12-11"", local = ""PLENÁRIO"", historico = ""HISTÓRICO DA TRAMITAÇÃO:\nPLENÁRIO:\nDISCUSSÃO ÚNICA\nAPROVAÇÃO: 20 12 1985\nREDAÇÃO FINAL\nAPROVAÇÃO: 20 12 1985\nCOMISSÕES:\nJUSTIÇA, ECONOMIA E FINANÇAS (REUNIÃO CONJUNTA)\nDISCUSSÃO ÚNICA\nRELATOR: DEP. WAINER ÁVILA\nPUBLICAÇÃO: 20 12 1985\nREDAÇÃO\nREDAÇÃO FINAL\nRELATOR: DEP. ALCYR NASCIMENTO\nPUBLICAÇÃO: 21 12 1985\nVETADO PARCIALMENTE\nPUBLICAÇÃO DA LEI: 28 12 1985\nMANTIDO O VETO"")",list(),list(),"list(descricao = ""MSG 894 1985"")",N,NA,NA,NULL,NA,NA,/legislacao/mineira/LEI/9119/1985,LEI 9119 1985 - LEI ORDINÁRIA,NA,NA,NULL,NA,NA,NA,NA,NA
Remissivo,PROJETO DE LEI,PL,2033,1985,GOVERNADOR DO ESTADO,ALTERA A TABELA PARA LANÇAMENTO E COBRANÇA DA TAXA FLORESTAL.,"FINANÇAS PÚBLICAS
MEIO AMBIENTE","ALTERAÇÃO, TABELA, ALÍQUOTA, COBRANÇA, TAXA FLORESTAL.
DISPOSITIVOS, DESTINAÇÃO, PERCENTAGEM, TAXA FLORESTAL, PROGRAMA,
PEQUENO PRODUTOR RURAL, MÉDIO PRODUTOR RURAL.",TRANSFORMADO EM NORMA JURÍDICA,TNJUR,PROPOSIÇÕES APROVADAS,MAPRV,1985-12-12,000147323,PL. 2033 1985 - PROJETO DE LEI,,DELIBERAÇÃO DE PLENÁRIO,"TRIBUTOS
MEIO AMBIENTE",LEI 9120 1985 - LEI ORDINÁRIA,20131014,1628,rosanacf,1985-12-11,"list(passo = 1, data = ""1985-12-11"", local = ""PLENÁRIO"", historico = ""HISTÓRICO DA TRAMITAÇÃO:\nPLENÁRIO:\nDISCUSSÃO ÚNICA\nAPROVAÇÃO: 20 12 1985 COM EMENDAS\nREDAÇÃO FINAL\nAPROVAÇÃO: 20 12 1985\nCOMISSÕES:\nJUSTIÇA, ECONOMIA E FINANÇAS (REUNIÃO CONJUNTA)\nDISCUSSÃO ÚNICA\nRELATOR: DEP. WAINER ÁVILA\nPUBLICAÇÃO: 20 12 1985\nREDAÇÃO\nREDAÇÃO FINAL\nRELATOR: DEP. MÁRIO PACHECO\nPUBLICAÇÃO: 21 12 1985\nSANCIONADO\nPUBLICAÇÃO DA LEI: 28 12 1985"")",list(),list(),"list(descricao = ""MSG 893 1985"")",N,NA,NA,NULL,NA,NA,/legislacao/mineira/LEI/9120/1985,LEI 9120 1985 - LEI ORDINÁRIA,NA,NA,NULL,NA,NA,NA,NA,NA
Remissivo,PROJETO DE LEI,PL,2032,1985,DEPUTADO EURÍPEDES CRAIDE                  PMDB,"AUTORIZA O GOVERNO DO ESTADO DE MINAS GERAIS A DOAR IMÓVEL QUE MENCIONA
À PREFEITURA MUNICIPAL DE CAPITÓLIO. (CONSTRUÇÃO DE UMA CRECHE.)",NA,"AUTORIZAÇÃO, EXECUTIVO, DOAÇÃO, IMÓVEL, MUNICÍPIO, CAPITÓLIO,
DESTINAÇÃO, CONSTRUÇÃO, CRECHE.",ARQUIVADO,ARQVD,OUTRAS SITUAÇÕES,MOUTR,1985-12-04,000147324,PL. 2032 1985 - PROJETO DE LEI,1187,NA,IMÓVEL,NA,20120529,1712,rosanacf,1985-11-29,"list(passo = 1, data = ""1985-11-29"", local = ""PLENÁRIO"", historico = ""HISTÓRICO DA TRAMITAÇÃO\nPLENÁRIO:\nPRIMEIRA DISCUSSÃO\nAPROVAÇÃO: 2 4 1986\nSEGUNDA DISCUSSÃO\nAPROVAÇÃO: 25 11 1986\nJUSTIÇA\nSEGUNDA DISCUSSÃO\nRELATOR: DEP. JOÃO NAVARRO\nECONOMIA\nSEGUNDA DISCUSSÃO\nRELATOR: DEP. GIL CÉSAR\nFINANÇAS\nSEGUNDA DISCUSSÃO\nRELATOR: DEP. JOÃO NAVARRO\nPARECERES PUBLICADOS EM 25 6 1986\nARQUIVADO, FINAL DE LEGISLATURA."")",list(),list(),NULL,N,ARQUIVO,19870131,"list(id = 1187, nome = ""DEPUTADO EURÍPEDES CRAIDE"", partido = ""PMDB"")",NA,NA,NA,NA,NA,NA,NULL,NA,NA,NA,NA,NA
Remissivo,PROJETO DE LEI,PL,2031,1985,DEPUTADO EURÍPEDES CRAIDE                  PMDB,"DECLARA DE UTILIDADE PÚBLICA O PATRONO JESUS MARIA JOSÉ, COM
SEDE NA CIDADE DE DORES DO INDAIÁ.",NA,"UTILIDADE PÚBLICA, ENTIDADE, MUNICÍPIO, DORES DO INDAIÁ.",TRANSFORMADO EM NORMA JURÍDICA,TNJUR,PROPOSIÇÕES APROVADAS,MAPRV,1985-12-04,000147325,PL. 2031 1985 - PROJETO DE LEI,1187,DELIBERAÇÃO DE PLENÁRIO,UTILIDADE PÚBLICA,LEI 9189 1986 - LEI ORDINÁRIA,20120126,1019,rosanacf,1985-11-29,"list(passo = 1, data = ""1985-11-29"", local = ""PLENÁRIO"", historico = ""HISTÓRICO DA TRAMITAÇÃO\nPLENÁRIO:\nPRIMEIRA DISCUSSÃO\nAPROVAÇÃO: 11 3 1986\nSEGUNDA DISCUSSÃO\nAPROVAÇÃO: 2 4 1986\nTERCEIRA DISCUSSÃO\nAPROVAÇÃO: 29 4 1986\nREDAÇÃO FINAL\nAPROVAÇÃO: 8 5 1986\nCOMISSÕES:\nJUSTIÇA\nSEGUNDA DISCUSSÃO\nRELATOR: DEP. NARCÉLIO MENDES\nPUBLICAÇÃO: 21 3 1986\nJUSTIÇA\nTERCEIRA DISCUSSÃO\nRELATOR: DEP. ROBERTO LUIZ SOARES\nPUBLICAÇÃO: 23 4 1986\nREDAÇÃO\nREDAÇÃO FINAL\nRELATOR: DEP. PETRÔNIO MATIAS\nPUBLICAÇÃO: 15 5 1986\nSANCIONADO\nPUBLICAÇÃO DA LEI: 14 6 1986"")",list(),list(),NULL,N,NA,NA,"list(id = 1187, nome = ""DEPUTADO EURÍPEDES CRAIDE"", partido = ""PMDB"")",NA,NA,/legislacao/mineira/LEI/9189/1986,LEI 9189 1986 - LEI ORDINÁRIA,NA,NA,NULL,NA,NA,NA,NA,NA
Remissivo,PROJETO DE LEI,PL,2030,1985,DEPUTADO EURÍPEDES CRAIDE                  PMDB,"AUTORIZA O GOVERNO DO ESTADO DE MINAS GERAIS A DOAR IMÓVEL QUE
MENCIONA À PREFEITURA MUNICIPAL DE CAPITÓLIO. (CONSTRUÇÃO DE FUTUROS
IMÓVEIS).",NA,"AUTORIZAÇÃO, EXECUTIVO, DOAÇÃO, IMÓVEL, MUNICÍPIO, CAPITÓLIO.",ARQUIVADO,ARQVD,OUTRAS SITUAÇÕES,MOUTR,1985-12-04,000147326,PL. 2030 1985 - PROJETO DE LEI,1187,NA,IMÓVEL,NA,20120529,1718,rosanacf,1985-11-29,"list(passo = 1, data = ""1985-11-29"", local = ""PLENÁRIO"", historico = ""HISTÓRICO DA TRAMITAÇÃO:\nPLENÁRIO:\nPRIMEIRA DISCUSSÃO\nAPROVAÇÃO: 26 3 1986\nARQUIVADO, FINAL DE LEGISLATURA"")",list(),list(),NULL,N,ARQUIVO,19870131,"list(id = 1187, nome = ""DEPUTADO EURÍPEDES CRAIDE"", partido = ""PMDB"")",NA,NA,NA,NA,NA,NA,NULL,NA,NA,NA,NA,NA
Remissivo,PROJETO DE LEI,PL,2029,1985,DEPUTADO GERALDO DA COSTA PEREIRA          PMDB,"DECLARA DE UTILIDADE PÚBLICA O CARMELO IMACULADA CONCEIÇÃO DA ORDEM DAS
CARMELITAS DESCALÇAS, COM SEDE EM DIVINÓPOLIS.",NA,"UTILIDADE PÚBLICA, ENTIDADE, MUNICÍPIO, DIVINÓPOLIS.",TRANSFORMADO EM NORMA JURÍDICA,TNJUR,PROPOSIÇÕES APROVADAS,MAPRV,1985-12-04,000147327,PL. 2029 1985 - PROJETO DE LEI,2036,DELIBERAÇÃO DE PLENÁRIO,UTILIDADE PÚBLICA,LEI 9174 1986 - LEI ORDINÁRIA,20150327,1723,malves,1985-11-29,"list(passo = 1, data = ""1985-11-29"", local = ""PLENÁRIO"", historico = ""HISTÓRICO DA TRAMITAÇÃO\nPLENÁRIO:\nPRIMEIRA DISCUSSÃO\nAPROVAÇÃO: 11 3 1986\nSEGUNDA DISCUSSÃO\nAPROVAÇÃO: 26 3 1986\nTERCEIRA DISCUSSÃO\nAPROVAÇÃO: 16 4 1986\nREDAÇÃO FINAL\nAPROVAÇÃO: 30 4 1986\nCOMISSÕES:\nJUSTIÇA\nSEGUNDA DISCUSSÃO\nRELATOR: DEP. NARCÉLIO MENDES\nPUBLICAÇÃO: 20 3 1986\nJUSTIÇA\nTERCEIRA DISCUSSÃO\nRELATOR: DEP. JOSÉ MOISÉS\nPUBLICAÇÃO: 11 4 1986\nREDAÇÃO\nREDAÇÃO FINAL\nRELATOR: DEP. JAIRO MAGALHÃES ALVES\nPUBLICAÇÃO: 6 5 1986\nSANCIONADO\nPUBLICAÇÃO DA LEI: 22 5 1986"")",list(),list(),NULL,N,NA,NA,"list(id = 2036, nome = ""DEPUTADO GERALDO DA COSTA PEREIRA"", partido = ""PMDB"")",NA,NA,/legislacao/mineira/LEI/9174/1986,LEI 9174 1986 - LEI ORDINÁRIA,NA,NA,NULL,NA,NA,NA,NA,NA
Remissivo,PROJETO DE LEI,PL,2028,1985,DEPUTADO NARCÉLIO MENDES                   PDS,"ALTERA AS DISPOSIÇÕES CONSTANTES DO ANEXO I, A QUE SE REFERE O
ARTIGO 45 DA LEI 7109, DE 13 DE OUTUBRO DE 1977.
(ESTATUTO DO MAGISTÉRIO: O ANEXO I SE REFERE AO ACESSO. PASSA A
INTEGRAR O REFERIDO ANEXO: PARA ACESSO À CLASSE DE PROFESSOR 6A E
ÀS DE ESPECIALISTA DE EDUCAÇÃO 6A, SERÁ CONSIDERADA HABILITAÇÃO
ESPECÍFICA A LICENCIATURA PLENA QUE CREDENCIE SIMULTANEAMENTE
PARA O EXERCÍCIO DE FUNÇÃO DE MAGISTÉRIO DE PRIMEIRO E SEGUNDO
GRAUS).",NA,NA,ARQUIVADO,ARQVD,OUTRAS SITUAÇÕES,MOUTR,1985-12-04,000147328,PL. 2028 1985 - PROJETO DE LEI,1465,DELIBERAÇÃO DE PLENÁRIO,NA,NA,20090803,1653,drumo,1985-11-29,"list(passo = 1, data = ""1985-11-29"", local = ""PLENÁRIO"", historico = ""HISTÓRICO DA TRAMITAÇÃO:\nPLENÁRIO:\nPRIMEIRA DISCUSSÃO\nAPROVAÇÃO: 2 4 1986\nARQUIVADO, FINAL DE LEGISLATURA"")",list(),list(),NULL,N,ARQUIVO,19870131,"list(id = 1465, nome = ""DEPUTADO NARCÉLIO MENDES"", partido = ""PDS"")",NA,NA,NA,NA,NA,NA,NULL,NA,NA,NA,NA,NA
Remissivo,PROJETO DE LEI,PL,2027,1985,DEPUTADO CLEUBER CARNEIRO                  PFL,"DÁ A DENOMINAÇÃO DE ESCOLA ESTADUAL PROFESSOR GERSON FERNANDES DE
SOUZA À ESCOLA ESTADUAL DE PINDAÍBA, NO MUNICÍPIO DE ITACARAMBI.",NA,"DENOMINAÇÃO, ESTABELECIMENTO DE ENSINO, MUNICÍPIO, ITACARAMBI.",TRANSFORMADO EM NORMA JURÍDICA,TNJUR,PROPOSIÇÕES APROVADAS,MAPRV,1985-12-04,000147329,PL. 2027 1985 - PROJETO DE LEI,2034,NA,"PRÓPRIO PÚBLICO
ESTABELECIMENTO DE ENSINO",LEI 9225 1986 - LEI ORDINÁRIA,20120423,1604,rosanacf,1985-11-29,"list(passo = 1, data = ""1985-11-29"", local = ""PLENÁRIO"", historico = ""HISTÓRICO DA TRAMITAÇÃO\nPLENÁRIO:\nPRIMEIRA DISCUSSÃO\nAPROVAÇÃO: 11 3 1986\nSEGUNDA DISCUSSÃO\nAPROVAÇÃO: 21 5 1986\nTERCEIRA DISCUSSÃO\nAPROVAÇÃO: 17 6 1986\nREDAÇÃO FINAL\nAPROVAÇÃO: 23 6 1986\nCOMISSÕES:\nJUSTIÇA\nSEGUNDA DISCUSSÃO\nRELATOR: DEP. JOÃO NAVARRO\nPUBLICAÇÃO: 14 5 1986\nJUSTIÇA\nTERCEIRA DISCUSSÃO\nRELATOR: DEP. JOÃO NAVARRO\nPUBLICAÇÃO: 11 6 1986\nREDAÇÃO\nREDAÇÃO FINAL\nRELATOR: DEP. ADEMIR LUCAS\nPUBLICAÇÃO: 24 6 1986\nSANCIONADO\nPUBLICAÇÃO DA LEI: 18 7 1986"")",list(),list(),NULL,N,NA,NA,"list(id = 2034, nome = ""DEPUTADO CLEUBER CARNEIRO"", partido = ""PFL"")",NA,NA,/legislacao/mineira/LEI/9225/1986,LEI 9225 1986 - LEI ORDINÁRIA,NA,NA,NULL,NA,NA,NA,NA,NA
Remissivo,PROJETO DE LEI,PL,2026,1985,DEPUTADO GERALDO PEREIRA SOBRINHO          PMDB,"DECLARA DE UTILIDADE PÚBLICA A FUNDAÇÃO JOSÉ FERNANDES DE ARAÚJO,
COM SEDE EM BELO HORIZONTE.",NA,"UTILIDADE PÚBLICA, ENTIDADE, MUNICÍPIO, BELO HORIZONTE.",TRANSFORMADO EM NORMA JURÍDICA,TNJUR,PROPOSIÇÕES APROVADAS,MAPRV,1985-12-04,000147330,PL. 2026 1985 - PROJETO DE LEI,74,DELIBERAÇÃO DE PLENÁRIO,UTILIDADE PÚBLICA,LEI 9172 1986 - LEI ORDINÁRIA,20120126,1020,rosanacf,1985-11-29,"list(passo = 1, data = ""1985-11-29"", local = ""PLENÁRIO"", historico = ""HISTÓRICO DA TRAMITAÇÃO\nPLENÁRIO:\nPRIMEIRA DISCUSSÃO\nAPROVAÇÃO: 7 3 1986\nSEGUNDA DISCUSSÃO\nAPROVAÇÃO: 26 3 1986\nTERCEIRA DISCUSSÃO\nAPROVAÇÃO: 16 4 1986\nREDAÇÃO FINAL\nAPROVAÇÃO: 30 4 1986\nCOMISSÕES:\nJUSTIÇA\nSEGUNDA DISCUSSÃO\nRELATOR: DEP. NARCÉLIO MENDES\nPUBLICAÇÃO: 20 3 1986\nJUSTIÇA\nTERCEIRA DISCUSSÃO\nRELATOR: DEP. JOSÉ MOISÉS\nPUBLICAÇÃO: 11 4 1986\nREDAÇÃO\nREDAÇÃO FINAL\nRELATOR: DEP. ARTUR FAGUNDES\nPUBLICAÇÃO: 6 5 1986\nSANCIONADO\nPUBLICAÇÃO DA LEI: 22 5 1986"")",list(),list(),NULL,N,NA,NA,"list(id = 74, nome = ""DEPUTADO GERALDO PEREIRA SOBRINHO"", partido = ""PMDB"")",NA,NA,/legislacao/mineira/LEI/9172/1986,LEI 9172 1986 - LEI ORDINÁRIA,NA,NA,NULL,NA,NA,NA,NA,NA
Remissivo,PROJETO DE LEI,PL,2025,1985,DEPUTADO GERALDO PEREIRA SOBRINHO          PMDB,"DECLARA DE UTILIDADE PÚBLICA A ACADEMIA FEMININA MINEIRA DE
LETRAS, COM SEDE EM BELO HORIZONTE.",NA,"UTILIDADE PÚBLICA, ENTIDADE, MUNICÍPIO, BELO HORIZONTE.",TRANSFORMADO EM NORMA JURÍDICA,TNJUR,PROPOSIÇÕES APROVADAS,MAPRV,1985-12-04,000147331,PL. 2025 1985 - PROJETO DE LEI,74,DELIBERAÇÃO DE PLENÁRIO,UTILIDADE PÚBLICA,LEI 9173 1986 - LEI ORDINÁRIA,20120126,1021,rosanacf,1985-11-29,"list(passo = 1, data = ""1985-11-29"", local = ""PLENÁRIO"", historico = ""HISTÓRICO DA TRAMITAÇÃO\nPLENÁRIO:\nPRIMEIRA DISCUSSÃO\nAPROVAÇÃO: 7 3 1986\nSEGUNDA DISCUSSÃO\nAPROVAÇÃO: 26 3 1986\nTERCEIRA DISCUSSÃO\nAPROVAÇÃO: 16 4 1986\nREDAÇÃO FINAL\nAPROVAÇÃO: 30 4 1986\nCOMISSÕES:\nJUSTIÇA\nSEGUNDA DISCUSSÃO\nRELATOR: DEP. NARCÉLIO MENDES\nPUBLICAÇÃO: 20 3 1986\nJUSTIÇA\nTERCEIRA DISCUSSÃO\nRELATOR: DEP. JOSÉ MOISÉS\nPUBLICAÇÃO: 11 4 1986\nREDAÇÃO\nREDAÇÃO FINAL\nRELATOR: DEP. JAIRO MAGALHÃES ALVES\nPUBLICAÇÃO: 6 5 1986\nSANCIONADO\nPUBLICAÇÃO DA LEI: 22 5 1986"")",list(),list(),NULL,N,NA,NA,"list(id = 74, nome = ""DEPUTADO GERALDO PEREIRA SOBRINHO"", partido = ""PMDB"")",NA,NA,/legislacao/mineira/LEI/9173/1986,LEI 9173 1986 - LEI ORDINÁRIA,NA,NA,NULL,NA,NA,NA,NA,NA
Remissivo,PROJETO DE LEI,PL,2024,1985,DEPUTADO JOÃO NAVARRO                      PDS,"DÁ A DENOMINAÇÃO DE FÓRUM JOAQUIM TEIXEIRA GONÇALVES AO FÓRUM DA
COMARCA DE ALTO RIO DOCE.",NA,"DENOMINAÇÃO, FÓRUM, COMARCA DE ALTO RIO DOCE.",TRANSFORMADO EM NORMA JURÍDICA,TNJUR,PROPOSIÇÕES APROVADAS,MAPRV,1985-11-29,000147333,PL. 2024 1985 - PROJETO DE LEI,311,NA,PRÓPRIO PÚBLICO,LEI 9193 1986 - LEI ORDINÁRIA,20120423,1605,rosanacf,1985-11-27,"list(passo = 1, data = ""1985-11-27"", local = ""PLENÁRIO"", historico = ""HISTÓRICO DA TRAMITAÇÃO\nPLENÁRIO:\nPRIMEIRA DISCUSSÃO\nAPROVAÇÃO: 7 3 1986\nSEGUNDA DISCUSSÃO\nAPROVAÇÃO: 2 4 1986\nTERCEIRA DISCUSSÃO\nAPROVAÇÃO: 29 4 1986\nREDAÇÃO FINAL\nAPROVAÇÃO: 8 5 1986\nCOMISSÕES:\nJUSTIÇA\nSEGUNDA DISCUSSÃO\nRELATOR: DEP. MENDES BARROS\nPUBLICAÇÃO: 27 3 1986\nJUSTIÇA\nTERCEIRA DISCUSSÃO\nRELATOR: DEP. JOÃO FERRAZ\nPUBLICAÇÃO: 24 4 1986\nREDAÇÃO\nREDAÇÃO FINAL\nRELATOR: DEP. PETRÔNIO MATIAS\nPUBLICAÇÃO: 15 5 1986\nSANCIONADO\nPUBLICAÇÃO DA LEI: 14 6 1986"")",list(),list(),NULL,N,NA,NA,"list(id = 311, nome = ""DEPUTADO JOÃO NAVARRO"", partido = ""PDS"")",NA,NA,/legislacao/mineira/LEI/9193/1986,LEI 9193 1986 - LEI ORDINÁRIA,NA,NA,NULL,NA,NA,NA,NA,NA
Remissivo,PROJETO DE LEI,PL,2023,1985,DEPUTADO JOSÉ LAVIOLA                      PMDB,"DECLARA DE UTILIDADE PÚBLICA O HOSPITAL NOSSA SENHORA DA CONCEIÇÃO, COM
SEDE NA CIDADE DE ABRE - CAMPO.",NA,"UTILIDADE PÚBLICA, ENTIDADE, MUNICÍPIO, ABRE-CAMPO.",RETIRADO DE TRAMITAÇÃO,RETRA,OUTRAS SITUAÇÕES,MOUTR,1985-11-29,000147334,PL. 2023 1985 - PROJETO DE LEI,1471,NA,UTILIDADE PÚBLICA,NA,20121106,1648,encnaves,1985-11-27,"list(passo = 1, data = ""1985-11-27"", local = ""PLENÁRIO"", historico = ""HISTÓRICO DA TRAMITAÇÃO\nPLENÁRIO:\nPRIMEIRA DISCUSSÃO\nAPROVAÇÃO: 5 3 1986\nCOMISSÕES:\nJUSTIÇA\nSEGUNDA DISCUSSÃO\nRELATOR: DEP. ROBERTO LUIZ SOARES\nPUBLICAÇÃO: 21 3 1986\nRETIRADO PELO AUTOR ATRAVÉS DE REQUERIMENTO APRESENTADO\nEM 26 3 1986 E PUBLICADO EM 1 4 1986.\nOBS.: JÁ É LEI DE 2138, DE 1 6 1960, PUBLICADA EM 2 6 1960"")",list(),list(),NULL,N,NA,NA,"list(id = 1471, nome = ""DEPUTADO JOSÉ LAVIOLA"", partido = ""PMDB"")",NA,NA,NA,NA,NA,NA,NULL,NA,NA,NA,NA,NA
Remissivo,PROJETO DE LEI,PL,2022,1985,DEPUTADA VERA COUTINHO                     PMDB,"DÁ NOVA REDAÇÃO AO ART. 2 E SEU PARÁGRAFO PRIMEIRO DA LEI 2473,
DE 27 DE OUTUBRO DE 1961, QUE INSTITUI PENSÃO ESPECIAL PARA O
SERVIDOR PÚBLICO ESTADUAL. (A CITADA LEI SE REFERE A VIÚVA. O
PRESENTE PROJETO CONTEMPLA QUALQUER DOS CÔNJUGES SOBREVIVENTES,
OBJETIVANDO PRESERVAR A DIGNIDADE DA FAMÍLIA DAQUELE OU DAQUELA
FUNCIONÁRIA PÚBLICA QUE VIER A FALECER, POR ACIDENTE, A SERVIÇO
DO ESTADO).",NA,NA,ARQUIVADO,ARQVD,OUTRAS SITUAÇÕES,MOUTR,1985-11-29,000147335,PL. 2022 1985 - PROJETO DE LEI,2816,DELIBERAÇÃO DE PLENÁRIO,NA,NA,20090803,1649,drumo,1985-11-27,"list(passo = 1, data = ""1985-11-27"", local = ""PLENÁRIO"", historico = ""HISTÓRICO DA TRAMITAÇÃO\nPLENÁRIO:\nPRIMEIRA DISCUSSÃO\nAPROVAÇÃO: 2 4 1986\nCOMISSÕES:\nJUSTIÇA\nSEGUNDA DISCUSSÃO\nRELATOR: DEP. WAINER ÁVILA\nPUBLICAÇÃO: 8 10 1986\nSERVIÇO PÚBLICO\nSEGUNDA DISCUSSÃO\nRELATOR: DEP. GERALDO RIBEIRO\nPUBLICAÇÃO: 8 10 1986\nFINANÇAS\nSEGUNDA DISCUSSÃO\nRELATOR: DEP. FERRAZ CALDAS\nPUBLICAÇÃO: 8 10 1986\nARQUIVADO, FINAL DE LEGISLATURA."")",list(),list(),NULL,N,ARQUIVO,19870131,"list(id = 2816, nome = ""DEPUTADA VERA COUTINHO"", partido = ""PMDB"")",NA,NA,NA,NA,NA,NA,NULL,NA,NA,NA,NA,NA
Remissivo,PROJETO DE LEI,PL,2021,1985,DEPUTADO JÉSUS TRINDADE                    PDS,"AUTORIZA O EXECUTIVO A ERIGIR MONUMENTO. (MONUMENTO A SER ERIGIDO
EM BELO HORIZONTE, EM HOMENAGEM AO CAPITÃO BENEDITO LOPES
BRAGANÇA).",NA,NA,ARQUIVADO,ARQVD,OUTRAS SITUAÇÕES,MOUTR,1985-11-29,000147336,PL. 2021 1985 - PROJETO DE LEI,1048,DELIBERAÇÃO DE PLENÁRIO,NA,NA,20090803,1647,drumo,1985-11-27,"list(passo = 1, data = ""1985-11-27"", local = ""PLENÁRIO"", historico = ""HISTÓRICO DA TRAMITAÇÃO\nPLENÁRIO:\nPRIMEIRA DISCUSSÃO\nAPROVAÇÃO: 18 6 1986\nCOMISSÕES:\nJUSTIÇA\nSEGUNDA DISCUSSÃO\nRELATOR: DEP. LUIZ VICENTE\nPUBLICAÇÃO: 29 11 1986\nPATRIMÔNIO HISTÓRICO, ARTÍSTICO E CULTURAL\nSEGUNDA DISCUSSÃO\nRELATOR: DEP. NEIF JABUR\nPUBLICAÇÃO: 29 11 1986\nOBRAS PÚBLICAS\nSEGUNDA DISCUSSÃO\nRELATOR: DEP. JOSÉ GERALDO DE OLIVEIRA\nPUBLICAÇÃO: 29 11 1986\nARQUIVADO, FINAL DE LEGISLATURA."")",list(),list(),NULL,N,ARQUIVO,19870131,"list(id = 1048, nome = ""DEPUTADO JÉSUS TRINDADE"", partido = ""PDS"")",NA,NA,NA,NA,NA,NA,NULL,NA,NA,NA,NA,NA
Remissivo,PROJETO DE LEI,PL,2020,1985,DEPUTADO SAMIR TANNÚS                      PMDB,"DECLARA DE UTILIDADE PÚBLICA O DEPARTAMENTO SOCIAL E FEMININO
SABEDORIA E AMOR, COM SEDE EM CANÁPOLIS.",NA,"UTILIDADE PÚBLICA, ENTIDADE, MUNICÍPIO, CANÁPOLIS.",TRANSFORMADO EM NORMA JURÍDICA,TNJUR,PROPOSIÇÕES APROVADAS,MAPRV,1985-11-29,000147337,PL. 2020 1985 - PROJETO DE LEI,1463,DELIBERAÇÃO DE PLENÁRIO,UTILIDADE PÚBLICA,LEI 9188 1986 - LEI ORDINÁRIA,20120126,1022,rosanacf,1985-11-27,"list(passo = 1, data = ""1985-11-27"", local = ""PLENÁRIO"", historico = ""HISTÓRICO DA TRAMITAÇÃO\nPLENÁRIO:\nPRIMEIRA DISCUSSÃO\nAPROVAÇÃO: 5 3 1986\nSEGUNDA DISCUSSÃO\nAPROVAÇÃO: 2 4 1986\nTERCEIRA DISCUSSÃO\nAPROVAÇÃO: 29 4 1986\nREDAÇÃO FINAL\nAPROVAÇÃO: 8 5 1986\nCOMISSÕES:\nJUSTIÇA\nSEGUNDA DISCUSSÃO\nRELATOR: DEP. NÍLSON GONTIJO\nPUBLICAÇÃO: 27 3 1986\nJUSTIÇA\nTERCEIRA DISCUSSÃO\nRELATOR: DEP. JOÃO FERRAZ\nPUBLICAÇÃO: 24 4 1986\nREDAÇÃO\nREDAÇÃO FINAL\nRELATOR: DEP. PETRÔNIO MATIAS\nPUBLICAÇÃO: 14 5 1986\nSANCIONADO\nPUBLICAÇÃO DA LEI: 14 6 1986"")",list(),list(),NULL,N,NA,NA,"list(id = 1463, nome = ""DEPUTADO SAMIR TANNÚS"", partido = ""PMDB"")",NA,NA,/legislacao/mineira/LEI/9188/1986,LEI 9188 1986 - LEI ORDINÁRIA,NA,NA,NULL,NA,NA,NA,NA,NA
Remissivo,PROJETO DE LEI,PL,2019,1985,DEPUTADO JOSÉ BONIFÁCIO FILHO              PDS,"AUTORIZA O PODER EXECUTIVO A ALTERAR O ÍNDICE DO VALOR DA
GRATIFICAÇÃO DE ESTÍMULO À PRODUÇÃO INDIVIDUAL DA CLASSE DE
ASSISTENTE DE TRIBUTAÇÃO E ARRECADAÇÃO, DE 80 PARA 100%, PREVISTO
NO PARÁGRAFO ÚNICO DO ARTIGO QUINTO DA LEI DELEGADA 4, DE 12 DE
JULHO DE 1985.",NA,NA,ARQUIVADO,ARQVD,OUTRAS SITUAÇÕES,MOUTR,1985-11-29,000147338,PL. 2019 1985 - PROJETO DE LEI,1697,DELIBERAÇÃO DE PLENÁRIO,NA,NA,20090803,1645,drumo,1985-11-27,"list(passo = 1, data = ""1985-11-27"", local = ""PLENÁRIO"", historico = ""HISTÓRICO DA TRAMITAÇÃO:\nPLENÁRIO:\nPRIMEIRA DISCUSSÃO\nAPROVAÇÃO: 2 4 1986\nARQUIVADO, FINAL DE LEGISLATURA"")",list(),list(),NULL,N,ARQUIVO,19870131,"list(id = 1697, nome = ""DEPUTADO JOSÉ BONIFÁCIO FILHO"", partido = ""PDS"")",NA,NA,NA,NA,NA,NA,NULL,NA,NA,NA,NA,NA
Remissivo,PROJETO DE LEI,PL,2018,1985,DEPUTADO MENDES BARROS                     PMDB,"DÁ A DENOMINAÇÃO DE PROFESSORA MARIA TEIXEIRA DA FONSECA À ESCOLA
ESTADUAL DE TARUMIRIM, MUNICÍPIO DE TARUMIRIM.",NA,"DENOMINAÇÃO, ESTABELECIMENTO DE ENSINO, MUNICÍPIO, TARUMIRIM.",TRANSFORMADO EM NORMA JURÍDICA,TNJUR,PROPOSIÇÕES APROVADAS,MAPRV,1985-11-29,000147339,PL. 2018 1985 - PROJETO DE LEI,1688,NA,"PRÓPRIO PÚBLICO
ESTABELECIMENTO DE ENSINO",LEI 9196 1986 - LEI ORDINÁRIA,20120423,1606,rosanacf,1985-11-27,"list(passo = 1, data = ""1985-11-27"", local = ""PLENÁRIO"", historico = ""HISTÓRICO DA TRAMITAÇÃO\nPLENÁRIO:\nPRIMEIRA DISCUSSÃO\nAPROVAÇÃO: 5 3 1986\nSEGUNDA DISCUSSÃO\nAPROVAÇÃO: 2 4 1986\nTERCEIRA DISCUSSÃO\nAPROVAÇÃO: 29 4 1986\nREDAÇÃO FINAL\nAPROVAÇÃO: 8 5 1986\nCOMISSÕES:\nJUSTIÇA\nSEGUNDA DISCUSSÃO\nRELATOR: DEP. ROBERTO LUIZ SOARES\nPUBLICAÇÃO: 27 3 1986\nJUSTIÇA\nTERCEIRA DISCUSSÃO\nRELATOR: DEP. JOÃO FERRAZ\nPUBLICAÇÃO: 24 4 1986\nREDAÇÃO\nREDAÇÃO FINAL\nRELATOR: DEP. PETRÔNIO MATIAS\nPUBLICAÇÃO: 14 5 1986\nSANCIONADO\nPUBLICAÇÃO DA LEI: 14 6 1986"")",list(),list(),NULL,N,NA,NA,"list(id = 1688, nome = ""DEPUTADO MENDES BARROS"", partido = ""PMDB"")",NA,NA,/legislacao/mineira/LEI/9196/1986,LEI 9196 1986 - LEI ORDINÁRIA,NA,NA,NULL,NA,NA,NA,NA,NA
Remissivo,PROJETO DE LEI,PL,2017,1985,MESA DA ASSEMBLÉIA,"MODIFICA A REDAÇÃO DO PARÁGRAFO PRIMEIRO DO ARTIGO SEXTO DA LEI
8.443, DE 6 DE OUTUBRO DE 1983. (CRIA O QUADRO SUPLEMENTAR DA SECRETARIA
DA ASSEMBLÉIA LEGISLATIVA E DÁ OUTRAS PROVIDÊNCIAS.)",ADMINISTRAÇÃO PÚBLICA,"ALTERAÇÃO, NORMAS, INTEGRAÇÃO, VENCIMENTOS, GRATIFICAÇÃO DE FUNÇÃO
AUXILIAR DA ATIVIDADE PARLAMENTAR, SERVIDOR, QUADRO DE PESSOAL, QUADRO
SUPLEMENTAR, SECRETARIA, (ALMG).",TRANSFORMADO EM NORMA JURÍDICA,TNJUR,PROPOSIÇÕES APROVADAS,MAPRV,1985-11-28,000147353,PL. 2017 1985 - PROJETO DE LEI,,DELIBERAÇÃO DE PLENÁRIO,"ASSEMBLEIA LEGISLATIVA DO ESTADO DE MINAS GERAIS (ALMG)
PESSOAL",LEI 9094 1985 - LEI ORDINÁRIA,20131014,1629,rosanacf,1985-11-27,"list(passo = 1, data = ""1985-11-27"", local = ""PLENÁRIO"", historico = ""HISTÓRICO DA TRAMITAÇÃO:\nPLENÁRIO:\nDISCUSSÃO ÚNICA\nAPROVAÇÃO: 30 11 1985\nREDAÇÃO FINAL\nAPROVAÇÃO: 30 11 1985\nCOMISSÕES:\nMESA DA ASSEMBLÉIA\nDISCUSSÃO ÚNICA\nRELATOR: DEP. FERNANDO RAINHO\nPUBLICAÇÃO: 30 11 1985\nREDAÇÃO\nREDAÇÃO FINAL\nRELATOR: DEP. WAINER ÁVILA\nPUBLICAÇÃO: 3 12 1985\nSANCIONADO\nPUBLICAÇÃO DA LEI: 18 12 1985"")",list(),list(),NULL,N,NA,NA,NULL,NA,NA,/legislacao/mineira/LEI/9094/1985,LEI 9094 1985 - LEI ORDINÁRIA,NA,NA,NULL,NA,NA,NA,NA,NA
Remissivo,PROJETO DE LEI,PL,2015,1985,GOVERNADOR DO ESTADO,"AUTORIZA O PODER EXECUTIVO A DOAR PARTE DE IMÓVEL AO MUNICÍPIO DE
ITAPECERICA. (DESTINAÇÃO: CONSTRUÇÃO DOS TAPUMES EM TODA A ÁREA
REMANESCENTE, SEM ÔNUS PARA O ESTADO DE MINAS GERAIS).",NA,"AUTORIZAÇÃO, EXECUTIVO, DOAÇÃO, IMÓVEL, MUNICÍPIO, ITAPECERICA.",TRANSFORMADO EM NORMA JURÍDICA,TNJUR,PROPOSIÇÕES APROVADAS,MAPRV,1985-11-29,000147340,PL. 2015 1985 - PROJETO DE LEI,,NA,IMÓVEL,LEI 9147 1986 - LEI ORDINÁRIA,20150707,1131,m17461,1985-11-27,"list(passo = 1, data = ""1985-11-27"", local = ""PLENÁRIO"", historico = ""HISTÓRICO DA TRAMITAÇÃO\nPLENÁRIO:\nDISCUSSÃO ÚNICA\nAPROVAÇÃO: 26 3 1986\nREDAÇÃO FINAL\nAPROVAÇÃO: 4 4 1986\nCOMISSÕES:\nJUSTIÇA, ECONOMIA E FINANÇAS (REUNIÃO CONJUNTA)\nDISCUSSÃO ÚNICA\nRELATOR: DEP. MANOEL CONEGUNDES\nPUBLICAÇÃO: 22 3 1986\nREDAÇÃO\nREDAÇÃO FINAL\nRELATOR: DEP. JAIRO MAGALHÃES ALVES\nPUBLICAÇÃO: 8 4 1986\nSANCIONADO\nPUBLICAÇÃO DA LEI: 29 4 1986"")",list(),list(),"list(descricao = ""MSG 885 1985"")",N,NA,NA,NULL,NA,NA,/legislacao/mineira/LEI/9147/1986,LEI 9147 1986 - LEI ORDINÁRIA,NA,NA,NULL,NA,NA,NA,NA,NA
Remissivo,PROJETO DE LEI,PL,2014,1985,DEPUTADO JAIRO MAGALHÃES ALVES             PSDB,"DECLARA DE UTILIDADE PÚBLICA A ESCOLA DE SAMBA BOCA BRANCA, COM
SEDE EM JOÃO MONLEVADE.",NA,"UTILIDADE PÚBLICA, ENTIDADE, MUNICÍPIO, JOÃO MONLEVADE.",TRANSFORMADO EM NORMA JURÍDICA,TNJUR,PROPOSIÇÕES APROVADAS,MAPRV,1985-11-28,000147354,PL. 2014 1985 - PROJETO DE LEI,2801,DELIBERAÇÃO DE PLENÁRIO,UTILIDADE PÚBLICA,LEI 9179 1986 - LEI ORDINÁRIA,20120126,1022,rosanacf,1985-11-26,"list(passo = 1, data = ""1985-11-26"", local = ""PLENÁRIO"", historico = ""HISTÓRICO DA TRAMITAÇÃO\nPLENÁRIO:\nPRIMEIRA DISCUSSÃO\nAPROVAÇÃO: 5 3 1986\nSEGUNDA DISCUSSÃO\nAPROVAÇÃO: 26 3 1986\nTERCEIRA DISCUSSÃO\nAPROVAÇÃO: 15 4 1986\nREDAÇÃO FINAL\nAPROVAÇÃO: 30 4 1986\nCOMISSÕES:\nJUSTIÇA\nSEGUNDA DISCUSSÃO\nRELATOR: DEP. ARMANDO COSTA\nPUBLICAÇÃO: 18 3 1986\nJUSTIÇA\nTERCEIRA DISCUSSÃO\nRELATOR: DEP. SAMIR CECÍLIO\nPUBLICAÇÃO: 11 4 1986\nREDAÇÃO\nREDAÇÃO FINAL\nRELATOR: DEP. JOSÉ MARIA BORGES\nPUBLICAÇÃO: 6 5 1986\nSANCIONADO\nPUBLICAÇÃO DA LEI: 23 5 1986"")",list(),list(),NULL,N,NA,NA,"list(id = 2801, nome = ""DEPUTADO JAIRO MAGALHÃES ALVES"", partido = ""PSDB"")",NA,NA,/legislacao/mineira/LEI/9179/1986,LEI 9179 1986 - LEI ORDINÁRIA,NA,NA,NULL,NA,NA,NA,NA,NA
Remissivo,PROJETO DE LEI,PL,2013,1985,DEPUTADO JAIRO MAGALHÃES ALVES             PSDB,"DECLARA DE UTILIDADE PÚBLICA O BAU ESPORTE CLUBE, COM SEDE EM
JOÃO MONLEVADE.",NA,"UTILIDADE PÚBLICA, ENTIDADE, MUNICÍPIO, JOÃO MONLEVADE.",TRANSFORMADO EM NORMA JURÍDICA,TNJUR,PROPOSIÇÕES APROVADAS,MAPRV,1985-11-28,000147355,PL. 2013 1985 - PROJETO DE LEI,2801,DELIBERAÇÃO DE PLENÁRIO,UTILIDADE PÚBLICA,LEI 9177 1986 - LEI ORDINÁRIA,20120126,1023,rosanacf,1985-11-26,"list(passo = 1, data = ""1985-11-26"", local = ""PLENÁRIO"", historico = ""HISTÓRICO DA TRAMITAÇÃO\nPLENÁRIO:\nPRIMEIRA DISCUSSÃO\nAPROVAÇÃO: 5 3 1986\nSEGUNDA DISCUSSÃO\nAPROVAÇÃO: 26 3 1986\nTERCEIRA DISCUSSÃO\nAPROVAÇÃO: 15 4 1986\nREDAÇÃO FINAL\nAPROVAÇÃO: 30 4 1986\nCOMISSÕES:\nJUSTIÇA\nSEGUNDA DISCUSSÃO\nRELATOR: DEP. ARMANDO COSTA\nPUBLICAÇÃO: 18 3 1986\nJUSTIÇA\nTERCEIRA DISCUSSÃO\nRELATOR: DEP. NÍLSON GONTIJO\nPUBLICAÇÃO: 3 4 1986\nREDAÇÃO\nREDAÇÃO FINAL\nRELATOR: DEP. JOSÉ MARIA BORGES\nPUBLICAÇÃO: 6 5 1986\nSANCIONADO\nPUBLICAÇÃO DA LEI: 22 5 1986"")",list(),list(),NULL,N,NA,NA,"list(id = 2801, nome = ""DEPUTADO JAIRO MAGALHÃES ALVES"", partido = ""PSDB"")",NA,NA,/legislacao/mineira/LEI/9177/1986,LEI 9177 1986 - LEI ORDINÁRIA,NA,NA,NULL,NA,NA,NA,NA,NA
